[
  {
    "id": "continuity-cell",
    "name": "Treatment continuity",
    "version": "1.0.0",
    "mode": "rules + forecasting",
    "inputs": ["adt.discharge", "treatment.scheduled", "attendance.changed", "transport.changed", "staffing.coverage.changed"],
    "outputs": ["continuity.risk", "continuity.proposal"],
    "allowedActions": ["create-coordinator-task", "propose-chair-swap"],
    "approvalClass": "B",
    "evalGate": 0.92,
    "killSwitch": true
  },
  {
    "id": "transition-cell",
    "name": "Hospital transition",
    "version": "1.0.0",
    "mode": "stream rules",
    "inputs": ["adt.discharge", "medication.changed", "order.changed"],
    "outputs": ["transition.gap", "transition.proposal"],
    "allowedActions": ["create-clinical-review", "propose-treatment-confirmation"],
    "approvalClass": "B",
    "evalGate": 0.95,
    "killSwitch": true
  },
  {
    "id": "assessment-cell",
    "name": "Assessment intelligence",
    "version": "1.0.0",
    "mode": "grounded language extraction",
    "inputs": ["assessment.response", "clinical.note"],
    "outputs": ["assessment.fact-candidate"],
    "allowedActions": ["request-human-confirmation"],
    "approvalClass": "C",
    "evalGate": 0.94,
    "killSwitch": true
  },
  {
    "id": "capacity-cell",
    "name": "Facility capacity",
    "version": "1.0.0",
    "mode": "constraint optimization",
    "inputs": ["facility.capacity.changed", "staffing.coverage.changed", "machine.maintenance.signal", "attendance.changed"],
    "outputs": ["capacity.option"],
    "allowedActions": ["propose-schedule-plan"],
    "approvalClass": "B",
    "evalGate": 0.98,
    "killSwitch": true
  },
  {
    "id": "access-cell",
    "name": "Access surveillance",
    "version": "1.0.0",
    "mode": "rules + anomaly detection",
    "inputs": ["quality.measure.changed", "access.observation", "culture.result", "antimicrobial.started"],
    "outputs": ["access.review-needed"],
    "allowedActions": ["create-nurse-review"],
    "approvalClass": "C",
    "evalGate": 0.97,
    "killSwitch": true
  },
  {
    "id": "cms-cell",
    "name": "CMS readiness",
    "version": "1.0.0",
    "mode": "deterministic measure engine",
    "inputs": ["cms.submission.gap", "measure.input", "submission.status"],
    "outputs": ["measure.result", "submission.gap"],
    "allowedActions": ["create-data-quality-task", "prepare-submission-package"],
    "approvalClass": "B",
    "evalGate": 1,
    "killSwitch": true
  },
  {
    "id": "workforce-cell",
    "name": "Workforce resilience",
    "version": "1.0.0",
    "mode": "constraint optimization",
    "inputs": ["staffing.coverage.changed", "credential.changed", "treatment.demand.changed"],
    "outputs": ["workforce.gap", "workforce.coverage-option"],
    "allowedActions": ["create-staffing-review", "propose-coverage-option"],
    "approvalClass": "B",
    "evalGate": 0.97,
    "killSwitch": true
  },
  {
    "id": "demand-cell",
    "name": "Growth and demand",
    "version": "1.0.0",
    "mode": "forecasting + constraints",
    "inputs": ["referral.received", "facility.capacity.changed", "admission.status.changed", "chair.changed"],
    "outputs": ["demand.forecast", "demand.capacity-option"],
    "allowedActions": ["create-referral-review", "propose-demand-plan"],
    "approvalClass": "B",
    "evalGate": 0.95,
    "killSwitch": true
  },
  {
    "id": "quality-cell",
    "name": "Clinical quality",
    "version": "1.0.0",
    "mode": "deterministic measures + surveillance",
    "inputs": ["quality.measure.changed", "infection.signal.changed", "care.plan.changed"],
    "outputs": ["quality.variance", "quality.review-needed"],
    "allowedActions": ["create-quality-review", "prepare-evidence-brief"],
    "approvalClass": "C",
    "evalGate": 0.98,
    "killSwitch": true
  },
  {
    "id": "experience-cell",
    "name": "Experience and equity",
    "version": "1.0.0",
    "mode": "grounded language extraction + rules",
    "inputs": ["experience.response", "assessment.response", "grievance.changed", "social-barrier.changed"],
    "outputs": ["experience.theme", "equity.review-needed"],
    "allowedActions": ["create-experience-followup", "request-human-confirmation"],
    "approvalClass": "C",
    "evalGate": 0.94,
    "killSwitch": true
  },
  {
    "id": "revenue-cell",
    "name": "Revenue cycle",
    "version": "1.0.0",
    "mode": "rules + anomaly detection",
    "inputs": ["claim.status.changed", "eligibility.changed", "treatment.completed"],
    "outputs": ["revenue.risk", "revenue.review-needed"],
    "allowedActions": ["create-revenue-cycle-review", "prepare-claim-evidence"],
    "approvalClass": "B",
    "evalGate": 0.96,
    "killSwitch": true
  },
  {
    "id": "asset-cell",
    "name": "Asset reliability",
    "version": "1.0.0",
    "mode": "rules + predictive maintenance",
    "inputs": ["machine.maintenance.signal", "machine.telemetry.changed", "maintenance.status.changed", "inventory.changed"],
    "outputs": ["asset.risk", "maintenance.option"],
    "allowedActions": ["create-biomed-review", "draft-maintenance-work-order"],
    "approvalClass": "B",
    "evalGate": 0.97,
    "killSwitch": true
  }
]
